{
  "kind": "formula",
  "id": "formula-combined-gas-law",
  "title": "Combined gas law",
  "name": "Combined gas law",
  "statement": "\\dfrac{P_1 V_1}{T_1} = \\dfrac{P_2 V_2}{T_2}",
  "regime": "model-exact",
  "dimension": [
    1,
    2,
    -2,
    0,
    -1,
    0
  ],
  "dimension_name": "energy per temperature",
  "variables": [
    {
      "symbol": "P₁",
      "meaning": "initial pressure",
      "unit": "atm",
      "dimension": [
        1,
        -1,
        -2,
        0,
        0,
        0
      ]
    },
    {
      "symbol": "V₁",
      "meaning": "initial volume",
      "unit": "L",
      "dimension": [
        0,
        3,
        0,
        0,
        0,
        0
      ]
    },
    {
      "symbol": "T₁",
      "meaning": "initial absolute temperature",
      "unit": "K",
      "dimension": [
        0,
        0,
        0,
        0,
        1,
        0
      ]
    },
    {
      "symbol": "P₂",
      "meaning": "final pressure",
      "unit": "atm",
      "dimension": [
        1,
        -1,
        -2,
        0,
        0,
        0
      ]
    },
    {
      "symbol": "V₂",
      "meaning": "final volume",
      "unit": "L",
      "dimension": [
        0,
        3,
        0,
        0,
        0,
        0
      ]
    },
    {
      "symbol": "T₂",
      "meaning": "final absolute temperature",
      "unit": "K",
      "dimension": [
        0,
        0,
        0,
        0,
        1,
        0
      ]
    }
  ],
  "terms": [
    {
      "side": "lhs",
      "display": "P₁V₁ / T₁",
      "factors": [
        {
          "var": "P₁",
          "power": 1
        },
        {
          "var": "V₁",
          "power": 1
        },
        {
          "var": "T₁",
          "power": -1
        }
      ],
      "dimension": [
        1,
        2,
        -2,
        0,
        -1,
        0
      ]
    },
    {
      "side": "rhs",
      "display": "P₂V₂ / T₂",
      "factors": [
        {
          "var": "P₂",
          "power": 1
        },
        {
          "var": "V₂",
          "power": 1
        },
        {
          "var": "T₂",
          "power": -1
        }
      ],
      "dimension": [
        1,
        2,
        -2,
        0,
        -1,
        0
      ]
    }
  ],
  "assumptions": [
    {
      "claim": "The amount of gas n is fixed — a sealed sample, no gas added or lost.",
      "kind": "model"
    },
    {
      "claim": "The gas behaves ideally over the whole change of state.",
      "kind": "model"
    }
  ],
  "summary": "For a sealed sample of gas, $PV/T$ is the same in any two states — because $nR$ is constant, $PV/T = nR$. Each side carries the dimension of energy-per-temperature; the machine checks they match. Set up the two states, cancel whatever is held constant, and solve for the missing quantity.",
  "related": [
    {
      "to": "formula-ideal-gas-law",
      "type": "special-case-of"
    }
  ],
  "lessons": [],
  "domain": "A fixed amount of gas taken from one state to another (Boyle's, Charles's, and Gay-Lussac's laws combined). Temperatures are absolute (kelvin).",
  "rearrangements": [
    "P_2 = \\dfrac{P_1 V_1 T_2}{T_1 V_2}",
    "V_2 = \\dfrac{P_1 V_1 T_2}{T_1 P_2}"
  ]
}
